{"exit_code":1,"observations":[{"definition":{"artifact_class":"kubernetes_rendered","capabilities":{"can_satisfy":true,"can_violate":true,"relationship_graph":true,"requires_complete_universe_for_violation":true,"source_span":false},"implementation":{"implementation_digest":"85b9c8ea508d50fcaa90f4e30dbc78a2f6b27932afe77e36abc623a45ae2bb51","implementation_version":"a9-v1","modules":[{"module":"fingerprints","sha256":"971d2e8e1ae3b9cbbf712f139de2e0c6bd2a6e2f42fed3c4c4fea98a7fc967b1"},{"module":"models","sha256":"c4710984833714c018c6de8864b6f3e00865c7bc1301874b565de84a0eb022d4"},{"module":"native_properties.contracts.prometheus-operator-v1","sha256":"68740bcc9738865f967a5a37bf74a53db18515a147840016be066dd207c14e4b"},{"module":"native_properties.engine","sha256":"347b678d26e4d480a330e6aaf544c7c894eaf12fe56841ab1078c9a6a4c584e2"},{"module":"native_properties.evidence","sha256":"643a8a33e9d3345d997cc329a50288386147d328c5c8caf2ce9ef28050383f70"},{"module":"native_properties.model","sha256":"af56a13f94cee0e7d1e22690e9487cf502aaa006f01a720ca5849a62f7e18732"},{"module":"native_properties.network_policy","sha256":"0188ceb2426d9fa513f7618d88d83c29db3abd6d02fa613bff344a66b830b81f"},{"module":"native_properties.outcome","sha256":"fd6355507f8e826c33d4e6f81d21c779693e0ad867b546d3ba28477b0f913e2d"},{"module":"native_properties.prometheus_operator","sha256":"055bd35302cee61f3f4b3f42154661363fb38fe3bd0536297620aa9f58fa6f1a"},{"module":"native_properties.registry","sha256":"3915310f26f15be5f40e821e848db47cc29b80f4ee9ef48a0940873dfe9fe870"},{"module":"native_properties.selectors","sha256":"ea696257f5c71be1576ab810e60611916dff5edd46b87260022758b661c8b754"},{"module":"native_properties.services","sha256":"5098f61b010ca074871d94ef5a2b75f64e17333b28449c0b3b95516499b29890"},{"module":"native_properties.universe","sha256":"f64fa2393e5702a68658b40714ecfe086c89d79372cadd3be0118619a8451015"}]},"parameter_schema":{"additionalProperties":false,"properties":{"endpoint_index":{"minimum":0,"type":"integer"},"expected_service":{"minLength":1,"type":"string"}},"required":[],"type":"object"},"parameter_schema_digest":"4d9f135dcc5b4f0aaaa7c47cdbbb48108009186675deb530bccb9b8396103e12","property_id":"IACGV_PROM_SERVICEMONITOR_RESOLVES_SERVICE_PORT_V1","property_namespace":"iac_guard_v","property_version":"1","semantic_binding":{"contract_digest":"bf6d98d0b1fb34073ef15b3a7081e51f928067ed25d09758c1233c52c48b4869","system":"kubernetes","version":"v1.34.0"},"semantic_definition_digest":"1d548554946507b9a6f5ec5fbda1f39af2fdc5416214ad6e0db8f6233e88d2d5","subject_class":"service_monitor","witness_type":"prometheus_monitor_resolution_v1"},"observation_digest":"7b6d636dcb7c8fc1c2d36322811bbb0d206fc51a7207a5eb55d13bc35f7db439","reason_code":"SERVICEMONITOR_TARGET_UNRESOLVED","request":{"artifact_class":"kubernetes_rendered","parameters":{"endpoint_index":0,"expected_service":"v1/Service/a9-impact/a9-impact-coredns-metrics"},"parameters_digest":"bd8b9d15c95f37e1f50b75ae9b1010855d2f2027a57415df102964e27b0edf2b","property_id":"IACGV_PROM_SERVICEMONITOR_RESOLVES_SERVICE_PORT_V1","property_version":"1","protected_universe_identity":"38e5139657dc4bface8c5ac75ba3d0efbd145d19ecff912184543ab45f96582d","request_id":"coredns-1470-monitor-on-service-off","subject_identity":"monitoring.coreos.com/v1/ServiceMonitor/default/a9-impact-coredns"},"result":"VIOLATED","subject_provenance":{"document_index":5,"file_path":"objects.yaml","identity":"monitoring.coreos.com/v1/ServiceMonitor/default/a9-impact-coredns","list_index":null,"source_sha256":"706e01ebc5d54261c29b41b36fdb4f4fdd0e3c4069b288c856a1af492f8c2f9f"},"witness":{"contents":{"contract_digest":"68740bcc9738865f967a5a37bf74a53db18515a147840016be066dd207c14e4b","endpoint":{"port":"metrics","protocol":"TCP"},"endpoint_index":0,"expected_service":"v1/Service/a9-impact/a9-impact-coredns-metrics","matched_services":[],"monitor":{"document_index":5,"file_path":"objects.yaml","identity":"monitoring.coreos.com/v1/ServiceMonitor/default/a9-impact-coredns","list_index":null,"source_sha256":"706e01ebc5d54261c29b41b36fdb4f4fdd0e3c4069b288c856a1af492f8c2f9f"},"namespace_selection":["a9-impact"],"service_candidates":[{"labels":{"app.kubernetes.io/instance":"a9-impact","app.kubernetes.io/managed-by":"Helm","app.kubernetes.io/name":"coredns","helm.sh/chart":"coredns-1.47.0","k8s-app":"coredns","kubernetes.io/cluster-service":"true","kubernetes.io/name":"CoreDNS"},"selector_evaluation":{"expressions":[{"key":"app.kubernetes.io/component","matched":false,"observed_present":false,"observed_value":null,"operator":"Equals","values":["metrics"]},{"key":"app.kubernetes.io/instance","matched":true,"observed_present":true,"observed_value":"a9-impact","operator":"Equals","values":["a9-impact"]},{"key":"app.kubernetes.io/name","matched":true,"observed_present":true,"observed_value":"coredns","operator":"Equals","values":["coredns"]},{"key":"k8s-app","matched":true,"observed_present":true,"observed_value":"coredns","operator":"Equals","values":["coredns"]}],"matched":false,"selector":{"matchExpressions":[],"matchLabels":{"app.kubernetes.io/component":"metrics","app.kubernetes.io/instance":"a9-impact","app.kubernetes.io/name":"coredns","k8s-app":"coredns"}},"target_labels":{"app.kubernetes.io/instance":"a9-impact","app.kubernetes.io/managed-by":"Helm","app.kubernetes.io/name":"coredns","helm.sh/chart":"coredns-1.47.0","k8s-app":"coredns","kubernetes.io/cluster-service":"true","kubernetes.io/name":"CoreDNS"}},"service":{"document_index":3,"file_path":"objects.yaml","identity":"v1/Service/a9-impact/a9-impact-coredns","list_index":null,"source_sha256":"706e01ebc5d54261c29b41b36fdb4f4fdd0e3c4069b288c856a1af492f8c2f9f"}}],"service_port_resolutions":[]},"witness_digest":"a1ff4a57a02ff8f1632b4183e6d2130c112770603a46ec49c12c771ab29ac324","witness_type":"prometheus_monitor_resolution_v1"}}],"product_semantics":"scanner-independent protected-manifest semantics","protected_universe":{"artifact_class":"kubernetes_rendered","identity":"38e5139657dc4bface8c5ac75ba3d0efbd145d19ecff912184543ab45f96582d","input_manifest_digest":"90784e01206233e6a8a68da670c87764ade5760fd9315c65ce6a9576a8bd18f4","resource_inventory_digest":"542e12bfc4a64bcba3b35b22e3ea803143c14ab9e36b9854b0b90b0890b8991f"},"registry_identity":"de9a293ea2d3da8dbdbbbe3b12aa5b5d212ba789af225ea714b18d91dc501f90","report_digest":"6cf2ef5e070c8e6035fa92c7e41675f5ede4a6e616e0c905eac93eae34f98c05","schema_version":"native-property-report-v1","summary":{"ERROR":0,"NOT_EVALUATED":0,"SATISFIED":0,"TOTAL":1,"UNSUPPORTED":0,"VIOLATED":1}}
